{
  "$schema": "../../schemas/page-record.schema.json",
  "schema_version": "1.0.0",
  "page": 32,
  "dossier_status": "AUDIT_PENDING",
  "audit_priority": 1,
  "public_verified_claim_count": 0,
  "last_reviewed": "2026-08-12",
  "notes": "Priority audit dossier; source artifacts are not public findings."
}
